{
  "schema_version": "0.1",
  "package_id": "org.osmium.pressure/medicine",
  "package_version": "0.1.0",
  "title": "Clinical reasoning: dehydration",
  "language": "en",
  "capabilities": {
    "required": [],
    "optional": []
  },
  "entities": {
    "concepts": "entities/concepts.json",
    "objectives": "entities/objectives.json",
    "curricula": "entities/curricula.json",
    "resources": "entities/resources.json",
    "assessments": "entities/assessments.json"
  },
  "extensions": {}
}
